{
  "branch_request_id": "breq_01J00000000000000000000000",
  "request_digest": "sha256:2da69c65a861fb3599b122e4a164a7a30bbeb899175fd7e81e5c829daf455e83",
  "branch": {
    "conversation_id": "conv_01J00000000000000000000000",
    "branch_id": "debug-rerun-01",
    "head_message_id": "msg_01J00000000000000000000000",
    "head_message_sequence": 1,
    "active_work_order_id": null,
    "workspace_head_revision_id": "wsr_fork_01J000000000000000000000",
    "workspace_head_revision_digest": "sha256:02f4a5ba74ee297dcd079277ca4f810a1a7e9379f6599c2d967037a25b8367f5",
    "message_head_version": 1,
    "workspace_head_version": 1,
    "active_work_version": 1,
    "branch_version": 1,
    "created_at": "2026-07-16T09:07:00Z",
    "updated_at": "2026-07-16T09:07:00Z",
    "forked_from_branch_id": "main",
    "forked_from_message_id": "msg_01J00000000000000000000000"
  },
  "workspace_revision": {
    "workspace_revision_id": "wsr_fork_01J000000000000000000000",
    "tenant_id": "ten_01J00000000000000000000000",
    "workspace_id": "wsp_01J00000000000000000000000",
    "branch_id": "debug-rerun-01",
    "revision_number": 1,
    "parent_revision_id": null,
    "content_manifest_artifact": {
      "artifact_id": "art_workspace_manifest_01J000000000000000",
      "version_id": "ver_workspace_manifest_01J00000000000000",
      "name": "workspace-manifest.json",
      "media_type": "application/vnd.agent.workspace-manifest+json",
      "role": "source",
      "digest": "sha256:ef0e25f8c192d97c4c99db13fba26569c7f78ca505e6b0db999c86398e4d86f5",
      "size_bytes": 641
    },
    "content_manifest_schema_id": "urn:agent-platform:workspace-content-manifest:v1",
    "produced_by_work_order_id": "wrk_01J00000000000000000000000",
    "revision_digest": "sha256:02f4a5ba74ee297dcd079277ca4f810a1a7e9379f6599c2d967037a25b8367f5",
    "created_at": "2026-07-16T09:07:00Z",
    "forked_from_revision_id": "wsr_01J00000000000000000000000"
  }
}
